Id_POI,Name_POI,Name_english,Longitude,Latitude,Category,Checkin user number,Category_en
B2094655D468A0FE459D,武汉十六中, Wuhan No. 16 Middle School,114.3007,30.59396,中学,123,Middle school
B2094655D464AAF9449E,华锦花园, Huajin Garden,114.31763,30.50407,住宅区,123,Residential area
B2094655D464A5F94798,湖北科教大厦, Hubei Science and Education Building,114.33901,30.54442,楼宇,123,Building
B2094757D564A6F4429F,湖北美术学院艺术设计学院," School of Art and Design, Hubei Academy of Fine Arts",114.409734,30.400856,高等院校,123,College
B2094655D56CABFF429D,世纪彩城, Century Color City,114.35675,30.57218,住宅区,122,Residential area
B2094655D56CABFF469A,都市经典, urban classic,114.35523,30.58033,住宅区,122,Residential area
B2094655D46FAAFE4698,华中科技大学(航空路), Huazhong University of Science and Technology ( air road ),114.26228,30.58255,高等院校,122,College
B2094757D16EA6F44098,武汉市体育馆, Wuhan Gymnasium,114.26149,30.578147,运动场所,122,Sports place
B2094655D46FAAF44992,汉口文化体育中心, Hankou Culture and Sports Center,114.26959,30.60149,综合体育馆,122,Comprehensive Stadium
B2094655D46CA0FC459E,新洲区第一中学, Xinzhou District No. 1 Middle School,114.81509,30.84664,中学,122,Middle school
B2094655D464AAF9459E,基督教圣米迦勒堂, christian saint michael church,114.30197,30.52944,教堂,121,church
B2094655D56DA5FD4192,武汉大学第10教学楼, Wuhan University No. 1 10 teaching building,114.36083,30.54417,高等院校,121,College
B2094757D169A4F94699,武汉市第八医院, Wuhan Eighth Hospital,114.305737,30.603523,医院,121,Hospital
B2094757D069A6FD4898,家乐福(建设店), Carrefour ( construction shop),114.285698,30.60655,超级市场,121,supermarket
